{
  "effective_assertions": {
    "activities": [
      {
        "assertion_id": "urn:uuid:4c16865d-9d20-58f5-a27b-2b54db413e6d",
        "associations": [
          {
            "agent_id": "urn:uuid:5f4679ce-75fe-5e1d-affa-78c842cf818f",
            "role": "https://nashspence.github.io/riverhog/v1/provenance/roles/observer"
          }
        ],
        "configuration": {
          "data": {
            "hash_chunk_bytes": "8388608",
            "include_sha512": false,
            "maximum_content_bytes": "9223372036854775807",
            "second_content_hash": false
          },
          "profile": {
            "contract_id": "https://nashspence.github.io/riverhog/v1/provenance",
            "contract_sha256": "8fb75de6c0eae617df0824b42711bcd87ecdcd27aa0828d24daf4ba8850c0f71",
            "schema_id": "https://nashspence.github.io/riverhog/v1/provenance/observers/schemas/observation-policy.json"
          }
        },
        "configuration_sha256": "538d8905da160c6a5228a7b45ce5710d120e5f73259dab1a8f97e1b2765b93ae",
        "ended_at": "2026-09-28T12:00:00.000000001Z",
        "evidence": [
          {
            "asserted_by_agent_id": "urn:uuid:5f4679ce-75fe-5e1d-affa-78c842cf818f",
            "basis": "direct_measurement",
            "method_uri": "https://nashspence.github.io/riverhog/v1/provenance/plans/opaque-bounded-source-observation"
          }
        ],
        "id": "urn:uuid:45b3ed54-2e94-5fee-a48d-cf825a830661",
        "kind": "observation",
        "outcome": "success",
        "plan_uri": "https://nashspence.github.io/riverhog/v1/provenance/plans/opaque-bounded-source-observation",
        "started_at": "2026-09-28T12:00:00.000000000Z",
        "type": "activity"
      }
    ],
    "agents": [
      {
        "assertion_id": "urn:uuid:701aa104-d667-58ad-a535-f07686369380",
        "evidence": [
          {
            "asserted_by_agent_id": "urn:uuid:5f4679ce-75fe-5e1d-affa-78c842cf818f",
            "basis": "identity_assignment"
          }
        ],
        "id": "urn:uuid:5f4679ce-75fe-5e1d-affa-78c842cf818f",
        "kind": "software",
        "name": "riverhog-provenance",
        "type": "agent",
        "version": "0.1.0"
      }
    ],
    "artifacts": [
      {
        "assertion_id": "urn:uuid:9b28b167-91f1-558a-bc41-6453c32c6b95",
        "continuity_policy_uri": "https://nashspence.github.io/riverhog/v1/provenance/policies/assigned-continuity",
        "evidence": [
          {
            "asserted_by_agent_id": "urn:uuid:5f4679ce-75fe-5e1d-affa-78c842cf818f",
            "basis": "identity_assignment"
          }
        ],
        "id": "urn:uuid:3e64977a-5ac9-5118-9322-fb0963644661",
        "type": "artifact"
      }
    ],
    "descriptions": [
      {
        "address_status": "not_exposed",
        "assertion_id": "urn:uuid:d3e01a79-1ed2-54ef-9700-6b59c152d062",
        "capabilities": {
          "bounded": true,
          "native_metadata": false,
          "persistent_designator": false,
          "repeatable": false,
          "seekable": false,
          "stable_version_selection": false
        },
        "capture_id": "urn:uuid:45b3ed54-2e94-5fee-a48d-cf825a830661",
        "consistency": {
          "level": "one_pass",
          "limitations": [
            "Only bytes yielded through this source boundary were measured.",
            "No upstream object atomicity, earlier pathname or earlier storage model is asserted."
          ],
          "method_uri": "https://nashspence.github.io/riverhog/v1/provenance/methods/bounded-read"
        },
        "content": {
          "digests": [
            {
              "algorithm": "sha-256",
              "value": "f78c7d97b5f935524a50ae8f38aaadc4ddc4bec73c9309492c3174d3d53ea741"
            }
          ],
          "size_bytes": "42"
        },
        "coverage": [
          {
            "category": "https://nashspence.github.io/riverhog/v1/provenance/coverage/primary_content",
            "profile_id": "https://nashspence.github.io/riverhog/v1/provenance",
            "status": "complete"
          }
        ],
        "evidence": [
          {
            "asserted_by_agent_id": "urn:uuid:5f4679ce-75fe-5e1d-affa-78c842cf818f",
            "basis": "direct_measurement",
            "method_uri": "https://nashspence.github.io/riverhog/v1/provenance/plans/opaque-bounded-source-observation"
          }
        ],
        "id": "urn:uuid:828f84bb-eed3-5b8f-973c-20d3c6b5378e",
        "state": {
          "object_id": "urn:uuid:aa4d9992-0616-5f64-8266-c6af0f16d428",
          "object_type": "state",
          "scope": "local"
        },
        "type": "observation"
      }
    ],
    "occurrences": [
      {
        "artifact_id": "urn:uuid:3e64977a-5ac9-5118-9322-fb0963644661",
        "assertion_id": "urn:uuid:1a34fc5c-f6ba-5980-86b8-4437ebad6765",
        "evidence": [
          {
            "asserted_by_agent_id": "urn:uuid:5f4679ce-75fe-5e1d-affa-78c842cf818f",
            "basis": "identity_assignment"
          }
        ],
        "id": "urn:uuid:4392b7c0-00d6-5672-ac12-6ee09189ea88",
        "kind": "stream_emission",
        "type": "occurrence"
      }
    ],
    "states": [
      {
        "assertion_id": "urn:uuid:d1667196-813b-53be-9210-191057621c38",
        "evidence": [
          {
            "asserted_by_agent_id": "urn:uuid:5f4679ce-75fe-5e1d-affa-78c842cf818f",
            "basis": "identity_assignment"
          }
        ],
        "extent": {
          "boundary_policy_uri": "https://nashspence.github.io/riverhog/v1/provenance/boundaries/emission-eof",
          "kind": "complete_emission"
        },
        "id": "urn:uuid:aa4d9992-0616-5f64-8266-c6af0f16d428",
        "occurrence_id": "urn:uuid:4392b7c0-00d6-5672-ac12-6ee09189ea88",
        "type": "state"
      }
    ]
  },
  "format": "riverhog-provenance-materialized/v1",
  "journal": {
    "journal_id": "urn:uuid:b6367f21-6b52-50df-8797-21dfd9a7c5a6",
    "prefix_bytes": "4957",
    "prefix_sha256": "dfbdf98b6d2bf8eb7e1596c949b99cfc1160e1025dbe03d3453ecb2f88174d37",
    "through": {
      "entry_id": "urn:uuid:0c9e364f-d24f-5ce0-8186-a9a4134e24e8",
      "json_sha256": "80bdd6dc56a8061fd7d170bcda636d3e7686f7970aa052bdbbc2fb9b78896c44",
      "sequence": "0"
    }
  },
  "retracted_assertion_ids": [],
  "unresolved_external_references": [],
  "unresolved_profiles": []
}
